{"version":1,"aws":{"accessKeyId":"AKIAISEMZIR2PBZ3IQCQ","secretAccessKey":"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","region":"us-east-1"},"keyPair":{"name":"keypair-dda39adb-49cc-e546-162d-1d4877d81c90","privateKey":"-----BEGIN RSA PRIVATE KEY-----\nMIIEogIBAAKCAQEAjoqid1CC6NRhjLl1xUum2uAA8Uvi9bw/C0YAicwVTg7nTyRzvThy3qnKA4Ld\nuA2Wcvx+GdKHXRbbkUT9h4CrtwiUr2iPD6e8UPgKw9oLPQ/XUZPzNi1jL1Yb05Lh52ljP7TOkHsj\nZcD1tFJm11psGZJRn7q6k9mHAoBhx0Mu+5f9Ypl5IOby7Bm9cP7VYDfTtZaHNT6z6xx6G8qsNstQ\nP2B4nwGmxwexkgLsKOfFNABdGPN9ucb79vMP9fa5df643cbsN6swRdaI/UsQKxW0JtDgcgU7sk9M\nm4RWUiEejLoqvULk5Lx/XbFIX6uRMIEeI914i+EiuZeNo3bufkTOIQIDAQABAoIBAHP41ZBv3+Kh\nETEWn3xDPeEsiXfI/0Jhw4VfkgaLFfZpZ8bbaJNWPxdsWyEaM1yRKYwqZEqMIHgbpc7+q6u4g30q\nrRY94s+g8DWMae3JFIW8wrnrvuCgcudLjt5Hziaidw6ZA8tHdJhQM1hgBq5GMldn1aM4oJ60SAVA\nAM3Hmo01d0UoADR3qnQFdpc4kaDPtttaADerGiWAzquB8St/E1rx8x2bv/aI80HgJWH9hsERggS4\n0YDZec4Xo3CiEFNx4MUjw4XrL3rqaH4m9jAR4mrqNhCn2ke30DOJ9HNb9JFb1c+9pzlCQQwbX/vD\nwKuLou9ll7jChNvSYcfyXhbrQqUCgYEAzhaMyLNe3Utfajw8oeZBDDrd7aJW/ujtfz2vK1yYMxjW\nJnvYfFV9ewN6Z01l2+A1lSM8URyjHGCTYl4clSM3F9U1QJcV+00PNoy5kevyfhjoFpFNBD+fFl7h\n9XUaUqyBx5GR7wIJqIeoQVydjsF9RXBcdFD5mArGPUekqtxn8WcCgYEAsRAz0j/avGkKR59d0fgG\nbD5aRQ6DURW9GMbqRjgVjdx/AlcYVc0MqkJyuboD7nijrjDwIPaPl77jX/LEsNNN9ovEMuyRDVLg\ndDGSHta8r5cxrdvym6Y0K7dHJJa3loi1X7YK6NJ38oNDGKyvG9ILyj6wv6PGIfRictV4niCE5zcC\ngYAoZ7FodApoVqu5V2AH2e3s6Omz+n0V8zMFHGHonXnVosvxtZxHHDfC03a/JCSRTE8VE1hzCqtM\nF/8tbQgrkUDu8kVDiZusrnoKFuMXIexkHpv6OLih2ZtmNmoUxsXHabz0FK1I79xW52nsjqzxXSwj\nXhkyUOHulkYxo4c8XIQghwKBgGd6nZ6JfO9RwBU9mRomBrLp+d2T7sDLoJjDX5UsH8SpkXyvo+Q5\nEubKMLxEbxnGXXpm1V+eWSsI/19KxRLGWzD0W/Sa9ua/gbfGZKwrOVixVvJRscavapwF38kNYDvU\np5NJE7Ufk8QiXGsmOKxcpFFNNAS71QZxCbws7/IR9TofAoGAAQTAEqPr78Pjtdwgloaqq7t7SWjB\nWSFBvqZoww50+iVA+N9COOWUgqeHPH18vcuyZIAx8J8Ho6VVrrdXOgi4Wb/XBEs+rr+QR1RjuI5O\n5K7RMITbkofe76DE9VFsRMGrNC9/xvxgjMda1TFAxHGK6gZUrVPdSdA2AzjGRUZjS0o=\n-----END RSA PRIVATE KEY-----","publicKey":""},"bosh":{"directorUsername":"user-vEYHxaN","directorPassword":"p-eXI8ijt3uLgw83u","directorAddress":"https://52.70.92.74:25555","directorSSLCertificate":"-----BEGIN CERTIFICATE-----\nMIIDLDCCAhSgAwIBAgICBNIwDQYJKoZIhvcNAQELBQAwPDEMMAoGA1UEBhMDVVNB\nMRYwFAYDVQQKEw1DbG91ZCBGb3VuZHJ5MRQwEgYDVQQDEws1Mi43MC45Mi43NDAe\nFw0xNjA3MDMwMjA3MzJaFw0xODA3MDMwMjA3MzJaMDwxDDAKBgNVBAYTA1VTQTEW\nMBQGA1UEChMNQ2xvdWQgRm91bmRyeTEUMBIGA1UEAxMLNTIuNzAuOTIuNzQwggEi\nMA0GCSqGSIb3DQEBAQUAA4IBDwAwggEKAoIBAQDuubhdyCims3XtiDXDBN8pV8ce\nEu+EIz3y75ATcBsA+0d2zxlWI+WjJlbr5rTpnUbxU0Kra/kjjrNGTkZlyzOZEY6T\nUyUMYam1jbusfm2nfGwJWQ/NTmOIEFgn9yzrwQJboUBkagLJMbytz9Km1EKQfbxG\ntAunHHObxPuPRC2cA2vQlPjBEfQDp9nL3dVojoao44pMWWbfFFB4wiVFCk68K0oo\ntG5/LTUabRfAc83+7Zgl97NMjDqteXWgtH82nqnxgXBmZ5XF3RvCIRRbpqWGv5vj\nxt5fugYyYtz2QdxxAnso5DtZ54fPP0YcmFVdrW4oamNDpvLYRiSgNLTlCeLfAgMB\nAAGjODA2MA4GA1UdDwEB/wQEAwIFIDATBgNVHSUEDDAKBggrBgEFBQcDATAPBgNV\nHREECDAGhwQ0RlxKMA0GCSqGSIb3DQEBCwUAA4IBAQCX8Ic0bG4kFXYxW5y04ncz\njJ2QEY70KJVaotIB0XuDhYTtlbDXTQomztDOTTMbiZP/Ly3vPU5OO2GFOKmFrDZo\n8f82b1JKaIHqdv+3E+2rRp2pHe1+3torbTt5i25amQhZFJtOIrcXgU3CBlzRcbEy\nY7TB7y3sP6BD75Y+o6vIfNWjbtPsLVg2YpKyQ0yN3oLASWeQ90NONcDictWZxVlj\nTXyaq87zNvM+YIS3Xk3m7+En/qy8+MD9fnCRWX9FyKcnPKUK29f6GOtuOfqQlaj/\nC5EK1TwpWh4rSFZfd3+6i6YEYopmlL/PdVgSj1iERvzw1WYcxEZKx0gaJ+TBMGq9\n-----END CERTIFICATE-----\n","directorSSLPrivateKey":"-----BEGIN RSA PRIVATE KEY-----\nMIIEpAIBAAKCAQEA7rm4XcgoprN17Yg1wwTfKVfHHhLvhCM98u+QE3AbAPtHds8Z\nViPloyZW6+a06Z1G8VNCq2v5I46zRk5GZcszmRGOk1MlDGGptY27rH5tp3xsCVkP\nzU5jiBBYJ/cs68ECW6FAZGoCyTG8rc/SptRCkH28RrQLpxxzm8T7j0QtnANr0JT4\nwRH0A6fZy93VaI6GqOOKTFlm3xRQeMIlRQpOvCtKKLRufy01Gm0XwHPN/u2YJfez\nTIw6rXl1oLR/Np6p8YFwZmeVxd0bwiEUW6alhr+b48beX7oGMmLc9kHccQJ7KOQ7\nWeeHzz9GHJhVXa1uKGpjQ6by2EYkoDS05Qni3wIDAQABAoIBACNVUbhvu7SQs0+o\n7Wwj+HPCDjKhUtoX7T9bvdNisFyA1J79IB7jyUVQk2TvDK/XG3z0edWtcX6VzGsH\ngtvmK4joVFXx5HXkrp20kKaDP++eNs9bYz9b7tdgs+uWZguu0Y6GW2WBW1A0EF0Z\neXA/0mpYcdl1JJRjXakciq81xBpnDgv422xsne5ZPvf1Vo7NeuK1ddljrWyujK7q\nllzYCfFZYmPDGNnYDu2laN33AAHJednGiK41c4+C00roVam1sm7RzWiKzMqQ5aAE\nD9LuBMCsKW+r1F0rZ7ymdplM6u4xQ/79qPQuZXLe/T3V8aufT7jVKPmm49n0qnVn\nIU6qr8ECgYEA+BU7Y/d9wQb4Xo96XrZKSL53tu59xbp9L0uzvpEyFrKBVNPqxQW3\nympfgjlY6dqY+VaXRt+l5WEjURo8Lv+0/r2UB7Py0mZ4dlXS7nAerwpsciFYYMZt\nsKB32Yet1/9bKFFHN6liTKKaMyziL9VXX3kx98JYkYIetaDhbXXhFekCgYEA9lgK\nUPrFpd8K+SVC4fLfYXyfU98+J6A1wsKp+SOToeKELBcY7Tk/+r3fmJsPiyDOxVyd\ne2V0KybMF7S32YDTmftWVik2p5KMcJ2Pf5KzW/hXipGgUTv7qDo9RRnSFazEFexd\nx/7eSWR6bANeU/DSU7iyuXHlnjn0OP9+mHZWjYcCgYBg4SG9SzQPwmIRw2QdQoDF\n4aOsi3wQUGB8rMp3vAncdT8uWkePQ0lfwaSknTKMuHIOxPL0mXgWmJWLIXypOfB7\nnpsFWw+TfLLEO4XQ2XYSEzcAZuc1e6fwVuoWx/ZqqGz31K3EHeCmXsVrALcfyOeD\nADg0MfAWesL1WOtPrL4GqQKBgQDa/Kq3ECYxbNRhZLlPCMuA6vrr4TFsomQILWpS\nGkk8CJQ8aY/0GgeBC9c/3t/zawfEtK8eKbMaRRP7IuCojngMkzxNvbdjQchst/P/\nkVa2NE8F1KzyaeMtyg/7ZJe4QuvRHVzE1BGgppyZdmkdL6CZYkAm0FQx0w0CukU8\nnT4V8wKBgQCQijeI9QVT3x+NTSLJiGJIe8LAZUaZyMBZTTLF+BGEf6VewSHUgJw/\n+Dw9KE4Olh+5VBXh+LpURJLtGymkc778HUKNT7wA3SP7rqkjYktvKqrpCOeJSPw9\nVYD57FobhQ7N8W9cUH96CpFyQoCjeQWoh/5WI37b3RwTKoEbShmjNw==\n-----END RSA PRIVATE KEY-----\n","credentials":{"blobstoreAgentPassword":"blobstore-agent-IIEMI8oe0mhfAXu","blobstoreAgentUsername":"blobstore-agent-user-85bmtExkZWurX1j","blobstoreDirectorPassword":"blobstore-director-oEvOv1PKVO9yPot","blobstoreDirectorUsername":"blobstore-director-user-hmfFqhNy0KXrg97","hmPassword":"hm-aZr6Tsd4oZXFeo0","hmUsername":"hm-user-ibn7jLiWBxobNV4","mbusPassword":"mbus-5qXzBbxBkNspMPZ","mbusUsername":"mbus-user-ivD1aQ4kVD7pDBu","natsPassword":"nats-xd8ojsaiSAEo8yR","natsUsername":"nats-user-PILCcn6DvFpVp2t","postgresPassword":"postgres-JUtKHjKKTM4A1nl","postgresUsername":"postgres-user-YhQVj8NAkIcfsQI","registryPassword":"registry-1Qj6YD0AmXqyDms","registryUsername":"registry-user-sQHKVpZk7kimORQ"},"state":{"current_disk_id":"c923da59-68a5-46f5-5bd8-defdbb421c85","current_manifest_sha1":"5bc751adbe3abdd9af946a5a40d3cbcf982a0ff6","current_release_ids":["c70520c8-813a-4ebf-570e-81491cdc316e","fbca8de0-dddd-45c4-54be-1a4a861381a9"],"current_stemcell_id":"7c791d46-acb5-4677-6507-ecb0eb6a94c6","current_vm_cid":"i-9f920319","director_id":"42fd805d-ff8c-4c68-60bc-a4a57de41353","disks":[{"cid":"vol-c2165d68","cloud_properties":{"encrypted":true,"type":"gp2"},"id":"c923da59-68a5-46f5-5bd8-defdbb421c85","size":20000}],"installation_id":"07fc70a6-7a4c-4c6c-4281-106783515a2d","releases":[{"id":"c70520c8-813a-4ebf-570e-81491cdc316e","name":"bosh","version":"257.1"},{"id":"fbca8de0-dddd-45c4-54be-1a4a861381a9","name":"bosh-aws-cpi","version":"53"}],"stemcells":[{"cid":"ami-55b77a38 light","id":"7c791d46-acb5-4677-6507-ecb0eb6a94c6","name":"bosh-aws-xen-hvm-ubuntu-trusty-go_agent","version":"3262"}]},"manifest":"name: bosh\nreleases:\n- name: bosh\n  url: https://s3.amazonaws.com/bbl-precompiled-bosh-releases/release-bosh-257.1-on-ubuntu-trusty-stemcell-3262.tgz\n  sha1: 83393ce5d40590cdb0978292e42027571cb20e17\n- name: bosh-aws-cpi\n  url: https://bosh.io/d/github.com/cloudfoundry-incubator/bosh-aws-cpi-release?v=53\n  sha1: 3a5988bd2b6e951995fe030c75b07c5b922e2d59\nresource_pools:\n- name: vms\n  network: private\n  stemcell:\n    url: https://bosh.io/d/stemcells/bosh-aws-xen-hvm-ubuntu-trusty-go_agent?v=3262\n    sha1: f04361747243dadc6e13ce74f5044b46931fb00a\n  cloud_properties:\n    instance_type: m3.xlarge\n    ephemeral_disk:\n      size: 25000\n      type: gp2\n    availability_zone: us-east-1c\ndisk_pools:\n- name: disks\n  disk_size: 20000\n  cloud_properties:\n    type: gp2\n    encrypted: true\nnetworks:\n- name: private\n  type: manual\n  subnets:\n  - range: 10.0.0.0/24\n    gateway: 10.0.0.1\n    dns:\n    - 10.0.0.2\n    cloud_properties:\n      subnet: subnet-6cedf81a\n- name: public\n  type: vip\njobs:\n- name: bosh\n  instances: 1\n  resource_pool: vms\n  persistent_disk_pool: disks\n  templates:\n  - name: nats\n    release: bosh\n  - name: postgres\n    release: bosh\n  - name: blobstore\n    release: bosh\n  - name: director\n    release: bosh\n  - name: health_monitor\n    release: bosh\n  - name: registry\n    release: bosh\n  - name: aws_cpi\n    release: bosh-aws-cpi\n  networks:\n  - name: private\n    static_ips:\n    - 10.0.0.6\n    default:\n    - dns\n    - gateway\n  - name: public\n    static_ips:\n    - 52.70.92.74\n  properties:\n    nats:\n      address: 127.0.0.1\n      user: nats-user-PILCcn6DvFpVp2t\n      password: nats-xd8ojsaiSAEo8yR\n    postgres:\n      listen_address: 127.0.0.1\n      host: 127.0.0.1\n      user: postgres-user-YhQVj8NAkIcfsQI\n      password: postgres-JUtKHjKKTM4A1nl\n      database: bosh\n      adapter: postgres\n    registry:\n      address: 10.0.0.6\n      host: 10.0.0.6\n      username: registry-user-sQHKVpZk7kimORQ\n      password: registry-1Qj6YD0AmXqyDms\n      port: 25777\n      db:\n        listen_address: 127.0.0.1\n        host: 127.0.0.1\n        user: postgres-user-YhQVj8NAkIcfsQI\n        password: postgres-JUtKHjKKTM4A1nl\n        database: bosh\n        adapter: postgres\n      http:\n        user: registry-user-sQHKVpZk7kimORQ\n        password: registry-1Qj6YD0AmXqyDms\n        port: 25777\n    blobstore:\n      address: 10.0.0.6\n      port: 25250\n      provider: dav\n      director:\n        user: blobstore-director-user-hmfFqhNy0KXrg97\n        password: blobstore-director-oEvOv1PKVO9yPot\n      agent:\n        user: blobstore-agent-user-85bmtExkZWurX1j\n        password: blobstore-agent-IIEMI8oe0mhfAXu\n    director:\n      address: 127.0.0.1\n      name: my-bosh\n      cpi_job: aws_cpi\n      max_threads: 10\n      enable_post_deploy: true\n      db:\n        listen_address: 127.0.0.1\n        host: 127.0.0.1\n        user: postgres-user-YhQVj8NAkIcfsQI\n        password: postgres-JUtKHjKKTM4A1nl\n        database: bosh\n        adapter: postgres\n      user_management:\n        provider: local\n        local:\n          users:\n          - name: user-vEYHxaN\n            password: p-eXI8ijt3uLgw83u\n          - name: hm-user-ibn7jLiWBxobNV4\n            password: hm-aZr6Tsd4oZXFeo0\n      ssl:\n        cert: |+\n          -----BEGIN CERTIFICATE-----\n          MIIDLDCCAhSgAwIBAgICBNIwDQYJKoZIhvcNAQELBQAwPDEMMAoGA1UEBhMDVVNB\n          MRYwFAYDVQQKEw1DbG91ZCBGb3VuZHJ5MRQwEgYDVQQDEws1Mi43MC45Mi43NDAe\n          Fw0xNjA3MDMwMjA3MzJaFw0xODA3MDMwMjA3MzJaMDwxDDAKBgNVBAYTA1VTQTEW\n          MBQGA1UEChMNQ2xvdWQgRm91bmRyeTEUMBIGA1UEAxMLNTIuNzAuOTIuNzQwggEi\n          MA0GCSqGSIb3DQEBAQUAA4IBDwAwggEKAoIBAQDuubhdyCims3XtiDXDBN8pV8ce\n          Eu+EIz3y75ATcBsA+0d2zxlWI+WjJlbr5rTpnUbxU0Kra/kjjrNGTkZlyzOZEY6T\n          UyUMYam1jbusfm2nfGwJWQ/NTmOIEFgn9yzrwQJboUBkagLJMbytz9Km1EKQfbxG\n          tAunHHObxPuPRC2cA2vQlPjBEfQDp9nL3dVojoao44pMWWbfFFB4wiVFCk68K0oo\n          tG5/LTUabRfAc83+7Zgl97NMjDqteXWgtH82nqnxgXBmZ5XF3RvCIRRbpqWGv5vj\n          xt5fugYyYtz2QdxxAnso5DtZ54fPP0YcmFVdrW4oamNDpvLYRiSgNLTlCeLfAgMB\n          AAGjODA2MA4GA1UdDwEB/wQEAwIFIDATBgNVHSUEDDAKBggrBgEFBQcDATAPBgNV\n          HREECDAGhwQ0RlxKMA0GCSqGSIb3DQEBCwUAA4IBAQCX8Ic0bG4kFXYxW5y04ncz\n          jJ2QEY70KJVaotIB0XuDhYTtlbDXTQomztDOTTMbiZP/Ly3vPU5OO2GFOKmFrDZo\n          8f82b1JKaIHqdv+3E+2rRp2pHe1+3torbTt5i25amQhZFJtOIrcXgU3CBlzRcbEy\n          Y7TB7y3sP6BD75Y+o6vIfNWjbtPsLVg2YpKyQ0yN3oLASWeQ90NONcDictWZxVlj\n          TXyaq87zNvM+YIS3Xk3m7+En/qy8+MD9fnCRWX9FyKcnPKUK29f6GOtuOfqQlaj/\n          C5EK1TwpWh4rSFZfd3+6i6YEYopmlL/PdVgSj1iERvzw1WYcxEZKx0gaJ+TBMGq9\n          -----END CERTIFICATE-----\n        key: |+\n          -----BEGIN RSA PRIVATE KEY-----\n          MIIEpAIBAAKCAQEA7rm4XcgoprN17Yg1wwTfKVfHHhLvhCM98u+QE3AbAPtHds8Z\n          ViPloyZW6+a06Z1G8VNCq2v5I46zRk5GZcszmRGOk1MlDGGptY27rH5tp3xsCVkP\n          zU5jiBBYJ/cs68ECW6FAZGoCyTG8rc/SptRCkH28RrQLpxxzm8T7j0QtnANr0JT4\n          wRH0A6fZy93VaI6GqOOKTFlm3xRQeMIlRQpOvCtKKLRufy01Gm0XwHPN/u2YJfez\n          TIw6rXl1oLR/Np6p8YFwZmeVxd0bwiEUW6alhr+b48beX7oGMmLc9kHccQJ7KOQ7\n          WeeHzz9GHJhVXa1uKGpjQ6by2EYkoDS05Qni3wIDAQABAoIBACNVUbhvu7SQs0+o\n          7Wwj+HPCDjKhUtoX7T9bvdNisFyA1J79IB7jyUVQk2TvDK/XG3z0edWtcX6VzGsH\n          gtvmK4joVFXx5HXkrp20kKaDP++eNs9bYz9b7tdgs+uWZguu0Y6GW2WBW1A0EF0Z\n          eXA/0mpYcdl1JJRjXakciq81xBpnDgv422xsne5ZPvf1Vo7NeuK1ddljrWyujK7q\n          llzYCfFZYmPDGNnYDu2laN33AAHJednGiK41c4+C00roVam1sm7RzWiKzMqQ5aAE\n          D9LuBMCsKW+r1F0rZ7ymdplM6u4xQ/79qPQuZXLe/T3V8aufT7jVKPmm49n0qnVn\n          IU6qr8ECgYEA+BU7Y/d9wQb4Xo96XrZKSL53tu59xbp9L0uzvpEyFrKBVNPqxQW3\n          ympfgjlY6dqY+VaXRt+l5WEjURo8Lv+0/r2UB7Py0mZ4dlXS7nAerwpsciFYYMZt\n          sKB32Yet1/9bKFFHN6liTKKaMyziL9VXX3kx98JYkYIetaDhbXXhFekCgYEA9lgK\n          UPrFpd8K+SVC4fLfYXyfU98+J6A1wsKp+SOToeKELBcY7Tk/+r3fmJsPiyDOxVyd\n          e2V0KybMF7S32YDTmftWVik2p5KMcJ2Pf5KzW/hXipGgUTv7qDo9RRnSFazEFexd\n          x/7eSWR6bANeU/DSU7iyuXHlnjn0OP9+mHZWjYcCgYBg4SG9SzQPwmIRw2QdQoDF\n          4aOsi3wQUGB8rMp3vAncdT8uWkePQ0lfwaSknTKMuHIOxPL0mXgWmJWLIXypOfB7\n          npsFWw+TfLLEO4XQ2XYSEzcAZuc1e6fwVuoWx/ZqqGz31K3EHeCmXsVrALcfyOeD\n          ADg0MfAWesL1WOtPrL4GqQKBgQDa/Kq3ECYxbNRhZLlPCMuA6vrr4TFsomQILWpS\n          Gkk8CJQ8aY/0GgeBC9c/3t/zawfEtK8eKbMaRRP7IuCojngMkzxNvbdjQchst/P/\n          kVa2NE8F1KzyaeMtyg/7ZJe4QuvRHVzE1BGgppyZdmkdL6CZYkAm0FQx0w0CukU8\n          nT4V8wKBgQCQijeI9QVT3x+NTSLJiGJIe8LAZUaZyMBZTTLF+BGEf6VewSHUgJw/\n          +Dw9KE4Olh+5VBXh+LpURJLtGymkc778HUKNT7wA3SP7rqkjYktvKqrpCOeJSPw9\n          VYD57FobhQ7N8W9cUH96CpFyQoCjeQWoh/5WI37b3RwTKoEbShmjNw==\n          -----END RSA PRIVATE KEY-----\n    hm:\n      director_account:\n        user: hm-user-ibn7jLiWBxobNV4\n        password: hm-aZr6Tsd4oZXFeo0\n      resurrector_enabled: true\n    aws:\n      access_key_id: AKIAJVDHQANFQQZOBA6Q\n      secret_access_key: 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\n      default_key_name: keypair-dda39adb-49cc-e546-162d-1d4877d81c90\n      default_security_groups:\n      - sg-a20657d9\n      region: us-east-1\n    agent:\n      mbus: nats://nats-user-PILCcn6DvFpVp2t:nats-xd8ojsaiSAEo8yR@10.0.0.6:4222\n    ntp:\n    - 0.pool.ntp.org\n    - 1.pool.ntp.org\ncloud_provider:\n  template:\n    name: aws_cpi\n    release: bosh-aws-cpi\n  ssh_tunnel:\n    host: 52.70.92.74\n    port: 22\n    user: vcap\n    private_key: ./bosh.pem\n  mbus: https://mbus-user-ivD1aQ4kVD7pDBu:mbus-5qXzBbxBkNspMPZ@52.70.92.74:6868\n  properties:\n    aws:\n      access_key_id: AKIAJVDHQANFQQZOBA6Q\n      secret_access_key: 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\n      default_key_name: keypair-dda39adb-49cc-e546-162d-1d4877d81c90\n      default_security_groups:\n      - sg-a20657d9\n      region: us-east-1\n    agent:\n      mbus: https://mbus-user-ivD1aQ4kVD7pDBu:mbus-5qXzBbxBkNspMPZ@0.0.0.0:6868\n    blobstore:\n      provider: local\n      path: /var/vcap/micro_bosh/data/cache\n    ntp:\n    - 0.pool.ntp.org\n    - 1.pool.ntp.org\n"},"stack":{"name":"bbl-aws-SFXQF","lbType":"cf","certificateName":"bbl-cert-3c9888af-b7f5-fbf1-059d-89a3bfbdeecb"}}
